{
  "$schema": "https://json-schema.org/draft/2020-12/schema",
  "title": "Contrat du harness (.harness/config.json)",
  "type": "object",
  "required": [
    "version",
    "components"
  ],
  "additionalProperties": false,
  "properties": {
    "$schema": {
      "type": "string"
    },
    "version": {
      "const": 1
    },
    "components": {
      "description": "Unités qui se testent et se construisent indépendamment. Un projet mono-stack n'en a qu'une.",
      "type": "object",
      "additionalProperties": {
        "type": "object",
        "required": [
          "path",
          "commands"
        ],
        "additionalProperties": false,
        "properties": {
          "path": {
            "type": "string",
            "description": "Dossier du composant, relatif à la racine. Les commandes s'y exécutent."
          },
          "stack": {
            "type": "string",
            "description": "Informatif : node, python, dotnet, go…"
          },
          "commands": {
            "type": "object",
            "description": "Commandes shell. Les variantes « -file » reçoivent {file}, chemin relatif au composant.",
            "properties": {
              "setup": {
                "type": "string",
                "description": "Installe les dépendances"
              },
              "build": {
                "type": "string"
              },
              "lint": {
                "type": "string"
              },
              "lint-file": {
                "type": "string",
                "pattern": "\\{file\\}"
              },
              "typecheck": {
                "type": "string"
              },
              "test": {
                "type": "string"
              },
              "test-file": {
                "type": "string",
                "pattern": "\\{file\\}"
              },
              "arch": {
                "type": "string",
                "description": "Règles de dépendance (fitness functions)"
              }
            },
            "additionalProperties": {
              "type": "string"
            }
          }
        }
      }
    },
    "architecture": {
      "type": "object",
      "additionalProperties": false,
      "properties": {
        "style": {
          "const": "feature-first"
        },
        "level": {
          "$ref": "#/$defs/level",
          "description": "Niveau par défaut du projet (voir .claude/rules/architecture.md)"
        },
        "features": {
          "type": "object",
          "description": "Niveau par feature, uniquement quand le besoin justifie un écart",
          "additionalProperties": {
            "$ref": "#/$defs/level"
          }
        },
        "profile": {
          "type": "object",
          "additionalProperties": false,
          "properties": {
            "size": {
              "enum": [
                "small",
                "medium",
                "large",
                null
              ]
            },
            "lifespan": {
              "enum": [
                "throwaway",
                "medium",
                "long",
                null
              ]
            },
            "domain_complexity": {
              "enum": [
                "low",
                "medium",
                "high",
                null
              ]
            }
          }
        }
      }
    },
    "trace": {
      "type": "object",
      "additionalProperties": false,
      "properties": {
        "min_coverage": {
          "type": "integer",
          "minimum": 0,
          "maximum": 100,
          "description": "Couverture minimale des scénarios des specs principales par des tests tagués @scenario (défaut 100)"
        },
        "test_pattern": {
          "type": "string",
          "description": "Expression régulière (chemins en « / ») des fichiers de test dont les tags @scenario comptent. Par défaut : dossiers test/, tests/, __tests__/, spec/, e2e/ et fichiers *.test.*, *_test.*, test_*.py, *Tests.cs…"
        }
      }
    },
    "tracks": {
      "type": "object",
      "description": "Pistes de travail, lues par le contrôle « pistes » de hx check. Défauts : S (correctif), M (feature), L (structurant) ; une clé ajoutée crée une piste. spec → au moins une delta spec ; design → design.md ; adr → design.md cite un ADR de docs/adr/.",
      "additionalProperties": {
        "type": "object",
        "additionalProperties": false,
        "properties": {
          "spec": {
            "type": "boolean"
          },
          "design": {
            "enum": [
              "optional",
              "required"
            ]
          },
          "adr": {
            "enum": [
              "optional",
              "required"
            ]
          }
        }
      }
    },
    "ship": {
      "type": "object",
      "description": "Livraison automatique : à la fin d'un run, hx-review lance /hx-ship seul si « hx confidence » l'autorise (piste M, aucune exclusion, score ≥ min_confidence), puis fait relire la PR et publie la revue en commentaire.",
      "additionalProperties": false,
      "properties": {
        "auto": {
          "type": "boolean",
          "description": "Autorise la livraison automatique (défaut false : l'utilisateur lance /hx-ship)"
        },
        "min_confidence": {
          "type": "integer",
          "minimum": 0,
          "maximum": 100,
          "description": "Score minimal de « hx confidence » pour livrer sans l'utilisateur (défaut 80)"
        }
      }
    }
  },
  "$defs": {
    "level": {
      "type": "integer",
      "minimum": 0,
      "maximum": 4,
      "description": "0 simple · 1 feature-first · 2 feature + domaine isolé · 3 monolithe modulaire clean · 4 distribué"
    }
  }
}
